{
  "$schema": "https://json-schema.org/draft/2020-12/schema",
  "$id": "https://github.com/GBeurier/dag-ml/schemas/controller_manifest.v1.schema.json",
  "title": "DAG-ML ControllerManifest v1",
  "type": "object",
  "additionalProperties": false,
  "required": [
    "controller_id",
    "controller_version",
    "operator_kind",
    "supported_phases",
    "fit_scope",
    "rng_policy",
    "artifact_policy"
  ],
  "properties": {
    "controller_id": {
      "$ref": "#/$defs/identifier"
    },
    "controller_version": {
      "$ref": "#/$defs/non_empty_string"
    },
    "operator_kind": {
      "$ref": "#/$defs/node_kind"
    },
    "priority": {
      "type": "integer",
      "minimum": 0,
      "maximum": 4294967295
    },
    "supported_phases": {
      "type": "array",
      "minItems": 1,
      "uniqueItems": true,
      "items": {
        "$ref": "#/$defs/phase"
      }
    },
    "input_ports": {
      "type": "array",
      "items": {
        "$ref": "#/$defs/port_spec"
      }
    },
    "output_ports": {
      "type": "array",
      "items": {
        "$ref": "#/$defs/port_spec"
      }
    },
    "data_requirements": {
      "anyOf": [
        { "$ref": "#/$defs/model_input_spec" },
        { "type": "null" }
      ]
    },
    "capabilities": {
      "type": "array",
      "uniqueItems": true,
      "items": {
        "$ref": "#/$defs/controller_capability"
      }
    },
    "operator_selectors": {
      "type": "array",
      "items": {
        "$ref": "#/$defs/operator_selector"
      }
    },
    "fit_scope": {
      "$ref": "#/$defs/controller_fit_scope"
    },
    "rng_policy": {
      "$ref": "#/$defs/rng_policy"
    },
    "artifact_policy": {
      "$ref": "#/$defs/artifact_policy"
    }
  },
  "$defs": {
    "identifier": {
      "type": "string",
      "minLength": 1,
      "maxLength": 128,
      "pattern": "^[A-Za-z0-9_.:-]+$"
    },
    "non_empty_string": {
      "type": "string",
      "minLength": 1
    },
    "node_kind": {
      "enum": [
        "transform",
        "y_transform",
        "split",
        "model",
        "fork",
        "map",
        "feature_join",
        "prediction_join",
        "mixed_join",
        "source_join",
        "tag",
        "exclude",
        "augmentation",
        "adapter",
        "aggregator",
        "generator",
        "restructure",
        "tuner",
        "subgraph",
        "chart"
      ]
    },
    "phase": {
      "enum": ["COMPILE", "PLAN", "FIT_CV", "SELECT", "REFIT", "PREDICT", "EXPLAIN"]
    },
    "port_kind": {
      "enum": ["data", "target", "prediction", "artifact", "metric", "control"]
    },
    "port_cardinality": {
      "enum": ["one", "many", "optional"]
    },
    "port_spec": {
      "type": "object",
      "additionalProperties": false,
      "required": ["name", "kind", "representation", "cardinality"],
      "properties": {
        "name": {
          "$ref": "#/$defs/non_empty_string"
        },
        "kind": {
          "$ref": "#/$defs/port_kind"
        },
        "representation": {
          "anyOf": [
            { "$ref": "#/$defs/non_empty_string" },
            { "type": "null" }
          ]
        },
        "cardinality": {
          "$ref": "#/$defs/port_cardinality"
        },
        "description": {
          "type": "string"
        }
      }
    },
    "controller_capability": {
      "enum": [
        "deterministic",
        "thread_safe",
        "process_safe",
        "needs_python_gil",
        "emits_predictions",
        "consumes_oof_predictions",
        "emits_artifacts",
        "stateful",
        "emits_relation",
        "uses_core_rng",
        "shape_changing",
        "generates_data",
        "generates_model",
        "expands_variants",
        "aggregates_predictions",
        "supports_sample_weights",
        "supports_row_resampling",
        "supports_backend_loss_weights",
        "supports_missing_masks",
        "supports_configurable_loss",
        "supports_custom_loss",
        "supports_differentiable_loss",
        "uses_training_weights",
        "uses_early_stopping",
        "performs_internal_tuning",
        "trains_aggregation",
        "supports_portable_full_refit"
      ]
    },
    "operator_selector": {
      "type": "object",
      "additionalProperties": false,
      "anyOf": [
        { "required": ["aliases"] },
        { "required": ["classes"] },
        { "required": ["class_prefixes"] },
        { "required": ["functions"] },
        { "required": ["refs"] },
        { "required": ["types"] }
      ],
      "properties": {
        "aliases": {
          "$ref": "#/$defs/non_empty_string_set"
        },
        "classes": {
          "$ref": "#/$defs/non_empty_string_set"
        },
        "class_prefixes": {
          "$ref": "#/$defs/non_empty_string_set"
        },
        "functions": {
          "$ref": "#/$defs/non_empty_string_set"
        },
        "refs": {
          "$ref": "#/$defs/non_empty_string_set"
        },
        "types": {
          "$ref": "#/$defs/non_empty_string_set"
        }
      }
    },
    "non_empty_string_set": {
      "type": "array",
      "minItems": 1,
      "uniqueItems": true,
      "items": {
        "$ref": "#/$defs/non_empty_string"
      }
    },
    "controller_fit_scope": {
      "enum": ["stateless", "fold_train", "full_train", "inference_only"]
    },
    "rng_policy": {
      "enum": [
        "uses_core_seed",
        "ignores_seed",
        "externally_deterministic",
        "nondeterministic"
      ]
    },
    "artifact_policy": {
      "enum": ["serializable", "host_only", "content_addressed", "replay_required"]
    },
    "model_input_spec": {
      "type": "object",
      "additionalProperties": false,
      "required": ["schema_version", "ports"],
      "properties": {
        "schema_version": {
          "const": 1
        },
        "ports": {
          "type": "array",
          "minItems": 1,
          "items": {
            "$ref": "#/$defs/model_input_port"
          }
        },
        "default_fusion": {
          "anyOf": [
            { "$ref": "#/$defs/model_input_fusion_policy" },
            { "type": "null" }
          ]
        },
        "fit_influence_policy": {
          "anyOf": [
            { "$ref": "#/$defs/fit_influence_policy" },
            { "type": "null" }
          ]
        },
        "metadata": {
          "type": "object"
        }
      }
    },
    "fit_influence_policy": {
      "enum": [
        "auto",
        "uniform_rows",
        "equal_sample_influence",
        "resample_equalized",
        "backend_loss_weight",
        "scorer_only",
        "strict_weight_support"
      ]
    },
    "entity_unit_level": {
      "enum": ["physical_sample", "source_sample", "observation", "combo"]
    },
    "combination_mode": {
      "enum": ["cartesian", "zip", "match_by", "sample_k", "reference_broadcast"]
    },
    "representation_missing_source_policy": {
      "enum": ["strict", "warn", "drop_incomplete", "impute_declared", "mask", "partial_model", "pad"]
    },
    "representation_cardinality": {
      "enum": ["one_to_one", "one_to_many", "many_to_one", "many_to_many", "bounded_many"]
    },
    "combination_plan": {
      "type": "object",
      "additionalProperties": false,
      "required": ["mode"],
      "properties": {
        "mode": { "$ref": "#/$defs/combination_mode" },
        "component_source_ids": {
          "type": "array",
          "uniqueItems": true,
          "items": { "$ref": "#/$defs/non_empty_string" }
        },
        "component_unit_ids": {
          "type": "array",
          "uniqueItems": true,
          "items": { "$ref": "#/$defs/non_empty_string" }
        },
        "match_key": { "type": ["string", "null"], "minLength": 1 },
        "reference_source_id": { "type": ["string", "null"], "minLength": 1 },
        "seed": { "type": ["integer", "null"], "minimum": 0 },
        "cap": { "type": ["integer", "null"], "minimum": 1 },
        "budget": { "type": ["integer", "null"], "minimum": 1 },
        "missing_source_policy": {
          "anyOf": [
            { "$ref": "#/$defs/representation_missing_source_policy" },
            { "type": "null" }
          ]
        },
        "metadata": { "type": "object" }
      }
    },
    "representation_plan": {
      "oneOf": [
        { "$ref": "#/$defs/aggregate_representation" },
        { "$ref": "#/$defs/cartesian_product_representation" },
        { "$ref": "#/$defs/monte_carlo_cartesian_representation" },
        { "$ref": "#/$defs/stack_fixed_representation" },
        { "$ref": "#/$defs/stack_padded_masked_representation" }
      ]
    },
    "aggregate_representation": {
      "type": "object",
      "additionalProperties": false,
      "required": ["kind", "input_unit_level", "output_unit_level", "cardinality"],
      "properties": {
        "kind": { "const": "aggregate" },
        "input_unit_level": { "$ref": "#/$defs/entity_unit_level" },
        "output_unit_level": { "$ref": "#/$defs/entity_unit_level" },
        "reducer_id": { "type": ["string", "null"], "minLength": 1 },
        "method": { "type": ["string", "null"], "minLength": 1 },
        "cardinality": { "$ref": "#/$defs/representation_cardinality" }
      }
    },
    "cartesian_product_representation": {
      "type": "object",
      "additionalProperties": false,
      "required": ["kind", "combination_plan", "output_unit_level", "cardinality"],
      "properties": {
        "kind": { "const": "cartesian_product" },
        "combination_plan": { "$ref": "#/$defs/combination_plan" },
        "output_unit_level": { "$ref": "#/$defs/entity_unit_level" },
        "cardinality": { "$ref": "#/$defs/representation_cardinality" },
        "preserve_provenance": { "type": "boolean" }
      }
    },
    "monte_carlo_cartesian_representation": {
      "type": "object",
      "additionalProperties": false,
      "required": ["kind", "combination_plan", "output_unit_level", "cardinality"],
      "properties": {
        "kind": { "const": "monte_carlo_cartesian" },
        "combination_plan": { "$ref": "#/$defs/combination_plan" },
        "output_unit_level": { "$ref": "#/$defs/entity_unit_level" },
        "cardinality": { "$ref": "#/$defs/representation_cardinality" },
        "preserve_provenance": { "type": "boolean" }
      }
    },
    "stack_fixed_representation": {
      "type": "object",
      "additionalProperties": false,
      "required": ["kind", "output_unit_level", "cardinality", "expected_cardinality"],
      "properties": {
        "kind": { "const": "stack_fixed" },
        "output_unit_level": { "$ref": "#/$defs/entity_unit_level" },
        "cardinality": { "$ref": "#/$defs/representation_cardinality" },
        "expected_cardinality": { "type": "integer", "minimum": 1 },
        "component_source_ids": {
          "type": "array",
          "uniqueItems": true,
          "items": { "$ref": "#/$defs/non_empty_string" }
        }
      }
    },
    "stack_padded_masked_representation": {
      "type": "object",
      "additionalProperties": false,
      "required": [
        "kind",
        "output_unit_level",
        "cardinality",
        "expected_cardinality",
        "missing_source_policy"
      ],
      "properties": {
        "kind": { "const": "stack_padded_masked" },
        "output_unit_level": { "$ref": "#/$defs/entity_unit_level" },
        "cardinality": { "$ref": "#/$defs/representation_cardinality" },
        "expected_cardinality": { "type": "integer", "minimum": 1 },
        "missing_source_policy": { "$ref": "#/$defs/representation_missing_source_policy" },
        "requires_missing_masks": { "type": "boolean" },
        "component_source_ids": {
          "type": "array",
          "uniqueItems": true,
          "items": { "$ref": "#/$defs/non_empty_string" }
        }
      }
    },
    "model_input_port": {
      "type": "object",
      "additionalProperties": false,
      "required": ["name", "accepted_representations", "accepted_types"],
      "properties": {
        "name": {
          "$ref": "#/$defs/non_empty_string"
        },
        "accepted_representations": {
          "type": "array",
          "minItems": 1,
          "uniqueItems": true,
          "items": {
            "$ref": "#/$defs/non_empty_string"
          }
        },
        "accepted_types": {
          "type": "array",
          "minItems": 1,
          "uniqueItems": true,
          "items": {
            "$ref": "#/$defs/non_empty_string"
          }
        },
        "rank": {
          "anyOf": [
            {
              "type": "integer",
              "minimum": 0,
              "maximum": 16
            },
            { "type": "null" }
          ]
        },
        "multi_source": {
          "type": "boolean"
        },
        "optional": {
          "type": "boolean"
        },
        "metadata": {
          "type": "object"
        }
      }
    },
    "model_input_fusion_policy": {
      "type": "object",
      "additionalProperties": false,
      "required": ["mode"],
      "properties": {
        "mode": {
          "enum": [
            "single_source",
            "concatenate_features",
            "stack_samples",
            "dict_by_source",
            "custom"
          ]
        },
        "alignment": {
          "type": ["string", "null"],
          "minLength": 1
        },
        "adapter_id": {
          "type": ["string", "null"],
          "minLength": 1
        },
        "representation_plan": {
          "anyOf": [
            { "$ref": "#/$defs/representation_plan" },
            { "type": "null" }
          ]
        },
        "params": {
          "type": "object"
        }
      }
    }
  }
}
